,id,place_name,description,category,coordinate,price,rating,range_price,place_tokens,place_tokens_fdist,place_tokens_WSW,place_tokens_stemmed
68,261.0,Kue Tapel Mba Lena,kue tapel mba lena adalah sejenis kue tradisional yang dikenal di daerah tertentu yang dijual atau dihasilkan oleh mba lena kue ini mungkin memiliki ciri khas dan resep khusus yang menjadi daya tariknya tapel adalah sejenis makanan tradisional yang terbuat dari tape singkong yang difermentasi kue tapel mba lena mungkin merupakan variasi atau inovasi khusus dari kue tapel yang ditawarkan oleh mba lena,Wisata Kuliner,"-6.7159489748827035, 108.56024767786305","Rp9,000",5.0,0-20000,"['kue', 'tapel', 'mba', 'lena', 'adalah', 'sejenis', 'kue', 'tradisional', 'yang', 'dikenal', 'di', 'daerah', 'tertentu', 'yang', 'dijual', 'atau', 'dihasilkan', 'oleh', 'mba', 'lena', 'kue', 'ini', 'mungkin', 'memiliki', 'ciri', 'khas', 'dan', 'resep', 'khusus', 'yang', 'menjadi', 'daya', 'tariknya', 'tapel', 'adalah', 'sejenis', 'makanan', 'tradisional', 'yang', 'terbuat', 'dari', 'tape', 'singkong', 'yang', 'difermentasi', 'kue', 'tapel', 'mba', 'lena', 'mungkin', 'merupakan', 'variasi', 'atau', 'inovasi', 'khusus', 'dari', 'kue', 'tapel', 'yang', 'ditawarkan', 'oleh', 'mba', 'lena']",<FreqDist with 37 samples and 63 outcomes>,"['kue', 'tapel', 'mba', 'lena', 'sejenis', 'kue', 'tradisional', 'dikenal', 'daerah', 'dijual', 'dihasilkan', 'mba', 'lena', 'kue', 'memiliki', 'ciri', 'khas', 'resep', 'khusus', 'daya', 'tariknya', 'tapel', 'sejenis', 'makanan', 'tradisional', 'terbuat', 'tape', 'singkong', 'difermentasi', 'kue', 'tapel', 'mba', 'lena', 'variasi', 'inovasi', 'khusus', 'kue', 'tapel', 'ditawarkan', 'mba', 'lena']","['kue', 'tapel', 'mba', 'lena', 'jenis', 'kue', 'tradisional', 'kenal', 'daerah', 'jual', 'hasil', 'mba', 'lena', 'kue', 'milik', 'ciri', 'khas', 'resep', 'khusus', 'daya', 'tarik', 'tapel', 'jenis', 'makan', 'tradisional', 'buat', 'tape', 'singkong', 'fermentasi', 'kue', 'tapel', 'mba', 'lena', 'variasi', 'inovasi', 'khusus', 'kue', 'tapel', 'tawar', 'mba', 'lena']"
69,262.0,Jumbo Restaurant Cirebon,restoran ini mungkin dikenal dengan menu atau hidangan khas yang ditawarkannya jumbo restaurant cirebon kemungkinan menawarkan berbagai macam hidangan mungkin termasuk hidangan khas daerah cirebon atau juga hidangan internasional restoran ini mungkin juga dikenal dengan pelayanan yang baik dan suasana yang nyaman,Wisata Kuliner,"-6.711732225709914, 108.56130242020086","Rp100,000",4.3,100000-200000,"['restoran', 'ini', 'mungkin', 'dikenal', 'dengan', 'menu', 'atau', 'hidangan', 'khas', 'yang', 'ditawarkannya', 'jumbo', 'restaurant', 'cirebon', 'kemungkinan', 'menawarkan', 'berbagai', 'macam', 'hidangan', 'mungkin', 'termasuk', 'hidangan', 'khas', 'daerah', 'cirebon', 'atau', 'juga', 'hidangan', 'internasional', 'restoran', 'ini', 'mungkin', 'juga', 'dikenal', 'dengan', 'pelayanan', 'yang', 'baik', 'dan', 'suasana', 'yang', 'nyaman']",<FreqDist with 27 samples and 42 outcomes>,"['restoran', 'dikenal', 'menu', 'hidangan', 'khas', 'ditawarkannya', 'jumbo', 'restaurant', 'cirebon', 'menawarkan', 'hidangan', 'hidangan', 'khas', 'daerah', 'cirebon', 'hidangan', 'internasional', 'restoran', 'dikenal', 'pelayanan', 'suasana', 'nyaman']","['restoran', 'kenal', 'menu', 'hidang', 'khas', 'tawar', 'jumbo', 'restaurant', 'cirebon', 'tawar', 'hidang', 'hidang', 'khas', 'daerah', 'cirebon', 'hidang', 'internasional', 'restoran', 'kenal', 'layan', 'suasana', 'nyaman']"
70,263.0,Rumah Makan Klapa Manis,rumah makan klapa manis adalah sebuah restoran yang mungkin terletak di suatu tempat tertentu restoran ini kemungkinan menawarkan hidanganhidangan khas yang menggunakan klapa kelapa sebagai salah satu bahan utamanya nama klapa manis mungkin mengacu pada rasa manis yang dimiliki oleh hidanganhidangan yang disajikan di restoran ini restoran ini mungkin menyajikan hidanganhidangan tradisional atau mungkin juga menyajikan variasi hidangan modern yang menggunakan klapa sebagai bahan utama,Wisata Kuliner,"-6.779016831127131, 108.5229307355563","Rp200,000",4.3,100000-200000,"['rumah', 'makan', 'klapa', 'manis', 'adalah', 'sebuah', 'restoran', 'yang', 'mungkin', 'terletak', 'di', 'suatu', 'tempat', 'tertentu', 'restoran', 'ini', 'kemungkinan', 'menawarkan', 'hidanganhidangan', 'khas', 'yang', 'menggunakan', 'klapa', 'kelapa', 'sebagai', 'salah', 'satu', 'bahan', 'utamanya', 'nama', 'klapa', 'manis', 'mungkin', 'mengacu', 'pada', 'rasa', 'manis', 'yang', 'dimiliki', 'oleh', 'hidanganhidangan', 'yang', 'disajikan', 'di', 'restoran', 'ini', 'restoran', 'ini', 'mungkin', 'menyajikan', 'hidanganhidangan', 'tradisional', 'atau', 'mungkin', 'juga', 'menyajikan', 'variasi', 'hidangan', 'modern', 'yang', 'menggunakan', 'klapa', 'sebagai', 'bahan', 'utama']",<FreqDist with 41 samples and 65 outcomes>,"['rumah', 'makan', 'klapa', 'manis', 'restoran', 'terletak', 'restoran', 'menawarkan', 'hidanganhidangan', 'khas', 'klapa', 'kelapa', 'salah', 'bahan', 'utamanya', 'nama', 'klapa', 'manis', 'mengacu', 'manis', 'dimiliki', 'hidanganhidangan', 'disajikan', 'restoran', 'restoran', 'menyajikan', 'hidanganhidangan', 'tradisional', 'menyajikan', 'variasi', 'hidangan', 'modern', 'klapa', 'bahan', 'utama']","['rumah', 'makan', 'klapa', 'manis', 'restoran', 'letak', 'restoran', 'tawar', 'hidanganhidangan', 'khas', 'klapa', 'kelapa', 'salah', 'bahan', 'utama', 'nama', 'klapa', 'manis', 'acu', 'manis', 'milik', 'hidanganhidangan', 'saji', 'restoran', 'restoran', 'saji', 'hidanganhidangan', 'tradisional', 'saji', 'variasi', 'hidang', 'modern', 'klapa', 'bahan', 'utama']"
71,264.0,Nasi Lengko H.Barno,nasi lengko hbarno adalah sebuah hidangan yang terkenal di daerah tertentu yang disajikan di warung atau kedai makan yang dimiliki oleh hbarno hidangan ini biasanya terdiri dari nasi yang disajikan dengan berbagai bahan seperti tahu tempe sayuran mie telur dan bumbu khas nasi lengko hbarno mungkin memiliki cita rasa khas dan resep yang diwariskan dari generasi ke generasi warung atau kedai ini mungkin telah menjadi tempat yang populer bagi penduduk setempat dan wisatawan untuk menikmati hidangan nasi lengko yang lezat dan autentik,Wisata Kuliner,"-6.716076771837743, 108.56056326436779","Rp13,000",4.2,0-20000,"['nasi', 'lengko', 'hbarno', 'adalah', 'sebuah', 'hidangan', 'yang', 'terkenal', 'di', 'daerah', 'tertentu', 'yang', 'disajikan', 'di', 'warung', 'atau', 'kedai', 'makan', 'yang', 'dimiliki', 'oleh', 'hbarno', 'hidangan', 'ini', 'biasanya', 'terdiri', 'dari', 'nasi', 'yang', 'disajikan', 'dengan', 'berbagai', 'bahan', 'seperti', 'tahu', 'tempe', 'sayuran', 'mie', 'telur', 'dan', 'bumbu', 'khas', 'nasi', 'lengko', 'hbarno', 'mungkin', 'memiliki', 'cita', 'rasa', 'khas', 'dan', 'resep', 'yang', 'diwariskan', 'dari', 'generasi', 'ke', 'generasi', 'warung', 'atau', 'kedai', 'ini', 'mungkin', 'telah', 'menjadi', 'tempat', 'yang', 'populer', 'bagi', 'penduduk', 'setempat', 'dan', 'wisatawan', 'untuk', 'menikmati', 'hidangan', 'nasi', 'lengko', 'yang', 'lezat', 'dan', 'autentik']",<FreqDist with 54 samples and 82 outcomes>,"['nasi', 'lengko', 'hbarno', 'hidangan', 'terkenal', 'daerah', 'disajikan', 'warung', 'kedai', 'makan', 'dimiliki', 'hbarno', 'hidangan', 'nasi', 'disajikan', 'bahan', 'tempe', 'sayuran', 'mie', 'telur', 'bumbu', 'khas', 'nasi', 'lengko', 'hbarno', 'memiliki', 'cita', 'khas', 'resep', 'diwariskan', 'generasi', 'generasi', 'warung', 'kedai', 'populer', 'penduduk', 'wisatawan', 'menikmati', 'hidangan', 'nasi', 'lengko', 'lezat', 'autentik']","['nasi', 'lengko', 'hbarno', 'hidang', 'kenal', 'daerah', 'saji', 'warung', 'kedai', 'makan', 'milik', 'hbarno', 'hidang', 'nasi', 'saji', 'bahan', 'tempe', 'sayur', 'mie', 'telur', 'bumbu', 'khas', 'nasi', 'lengko', 'hbarno', 'milik', 'cita', 'khas', 'resep', 'waris', 'generasi', 'generasi', 'warung', 'kedai', 'populer', 'duduk', 'wisatawan', 'nikmat', 'hidang', 'nasi', 'lengko', 'lezat', 'autentik']"
72,265.0,Nasi Jamblang Bu Nur,nasi jamblang bu nur adalah sebuah hidangan khas yang berasal dari daerah jamblang cirebon nasi jamblang ini biasanya disajikan dengan berbagai macam laukpauk tradisional seperti ayam goreng empal sambal dan aneka sayuran nama bu nur mungkin merujuk kepada pemilik atau pendiri warung atau kedai yang terkenal dengan hidangan nasi jamblangnya warung nasi jamblang bu nur mungkin menjadi tempat yang populer bagi penduduk setempat dan wisatawan untuk menikmati hidangan nasi dengan cita rasa yang khas dan autentik dari daerah jamblang,Wisata Kuliner,"-6.714267139745754, 108.55498199323348","Rp20,000",4.4,0-20000,"['nasi', 'jamblang', 'bu', 'nur', 'adalah', 'sebuah', 'hidangan', 'khas', 'yang', 'berasal', 'dari', 'daerah', 'jamblang', 'cirebon', 'nasi', 'jamblang', 'ini', 'biasanya', 'disajikan', 'dengan', 'berbagai', 'macam', 'laukpauk', 'tradisional', 'seperti', 'ayam', 'goreng', 'empal', 'sambal', 'dan', 'aneka', 'sayuran', 'nama', 'bu', 'nur', 'mungkin', 'merujuk', 'kepada', 'pemilik', 'atau', 'pendiri', 'warung', 'atau', 'kedai', 'yang', 'terkenal', 'dengan', 'hidangan', 'nasi', 'jamblangnya', 'warung', 'nasi', 'jamblang', 'bu', 'nur', 'mungkin', 'menjadi', 'tempat', 'yang', 'populer', 'bagi', 'penduduk', 'setempat', 'dan', 'wisatawan', 'untuk', 'menikmati', 'hidangan', 'nasi', 'dengan', 'cita', 'rasa', 'yang', 'khas', 'dan', 'autentik', 'dari', 'daerah', 'jamblang']",<FreqDist with 52 samples and 79 outcomes>,"['nasi', 'jamblang', 'bu', 'nur', 'hidangan', 'khas', 'berasal', 'daerah', 'jamblang', 'cirebon', 'nasi', 'jamblang', 'disajikan', 'laukpauk', 'tradisional', 'ayam', 'goreng', 'empal', 'sambal', 'aneka', 'sayuran', 'nama', 'bu', 'nur', 'merujuk', 'pemilik', 'pendiri', 'warung', 'kedai', 'terkenal', 'hidangan', 'nasi', 'jamblangnya', 'warung', 'nasi', 'jamblang', 'bu', 'nur', 'populer', 'penduduk', 'wisatawan', 'menikmati', 'hidangan', 'nasi', 'cita', 'khas', 'autentik', 'daerah', 'jamblang']","['nasi', 'jamblang', 'bu', 'nur', 'hidang', 'khas', 'asal', 'daerah', 'jamblang', 'cirebon', 'nasi', 'jamblang', 'saji', 'laukpauk', 'tradisional', 'ayam', 'goreng', 'empal', 'sambal', 'aneka', 'sayur', 'nama', 'bu', 'nur', 'rujuk', 'milik', 'diri', 'warung', 'kedai', 'kenal', 'hidang', 'nasi', 'jamblang', 'warung', 'nasi', 'jamblang', 'bu', 'nur', 'populer', 'duduk', 'wisatawan', 'nikmat', 'hidang', 'nasi', 'cita', 'khas', 'autentik', 'daerah', 'jamblang']"
73,266.0,Empal Gentong H.Apud,empal gentong hapud adalah sebuah hidangan khas dari daerah cirebon jawa barat empal gentong merupakan masakan berbahan dasar daging sapi yang dimasak dengan berbagai rempahrempah dan bumbu khas kemudian disajikan dengan kuah yang kaya akan rasa dan aroma hapud mungkin merujuk kepada nama pemilik atau pendiri warung atau kedai yang terkenal dengan hidangan empal gentongnya warung empal gentong hapud mungkin telah menjadi tempat yang populer bagi penduduk setempat dan wisatawan untuk menikmati hidangan yang lezat dan autentik dari cirebon,Wisata Kuliner,"-6.706291170440092, 108.518350591212","Rp22,000",4.1,20000-50000,"['empal', 'gentong', 'hapud', 'adalah', 'sebuah', 'hidangan', 'khas', 'dari', 'daerah', 'cirebon', 'jawa', 'barat', 'empal', 'gentong', 'merupakan', 'masakan', 'berbahan', 'dasar', 'daging', 'sapi', 'yang', 'dimasak', 'dengan', 'berbagai', 'rempahrempah', 'dan', 'bumbu', 'khas', 'kemudian', 'disajikan', 'dengan', 'kuah', 'yang', 'kaya', 'akan', 'rasa', 'dan', 'aroma', 'hapud', 'mungkin', 'merujuk', 'kepada', 'nama', 'pemilik', 'atau', 'pendiri', 'warung', 'atau', 'kedai', 'yang', 'terkenal', 'dengan', 'hidangan', 'empal', 'gentongnya', 'warung', 'empal', 'gentong', 'hapud', 'mungkin', 'telah', 'menjadi', 'tempat', 'yang', 'populer', 'bagi', 'penduduk', 'setempat', 'dan', 'wisatawan', 'untuk', 'menikmati', 'hidangan', 'yang', 'lezat', 'dan', 'autentik', 'dari', 'cirebon']",<FreqDist with 55 samples and 79 outcomes>,"['empal', 'gentong', 'hapud', 'hidangan', 'khas', 'daerah', 'cirebon', 'jawa', 'barat', 'empal', 'gentong', 'masakan', 'berbahan', 'dasar', 'daging', 'sapi', 'dimasak', 'rempahrempah', 'bumbu', 'khas', 'disajikan', 'kuah', 'kaya', 'aroma', 'hapud', 'merujuk', 'nama', 'pemilik', 'pendiri', 'warung', 'kedai', 'terkenal', 'hidangan', 'empal', 'gentongnya', 'warung', 'empal', 'gentong', 'hapud', 'populer', 'penduduk', 'wisatawan', 'menikmati', 'hidangan', 'lezat', 'autentik', 'cirebon']","['empal', 'gentong', 'hapud', 'hidang', 'khas', 'daerah', 'cirebon', 'jawa', 'barat', 'empal', 'gentong', 'masakan', 'bahan', 'dasar', 'daging', 'sapi', 'masak', 'rempahrempah', 'bumbu', 'khas', 'saji', 'kuah', 'kaya', 'aroma', 'hapud', 'rujuk', 'nama', 'milik', 'diri', 'warung', 'kedai', 'kenal', 'hidang', 'empal', 'gentong', 'warung', 'empal', 'gentong', 'hapud', 'populer', 'duduk', 'wisatawan', 'nikmat', 'hidang', 'lezat', 'autentik', 'cirebon']"
74,267.0,Empal Asem Amarta,empal asem amarta adalah sebuah hidangan khas yang terkenal di daerah amarta cirebon empal asem merupakan masakan berbahan dasar daging sapi yang dimasak dengan campuran bumbubumbu rempah dan asemaseman sehingga memberikan cita rasa yang khas dan segar nama amarta mungkin merujuk kepada nama tempat atau mungkin pemilik atau pendiri warung atau kedai yang terkenal dengan hidangan empal asemnya warung empal asem amarta mungkin telah menjadi destinasi yang populer bagi para pecinta kuliner untuk menikmati hidangan yang lezat dan autentik dari daerah amarta cirebon,Wisata Kuliner,"-6.707556747449836, 108.51737036252743","Rp25,000",4.6,20000-50000,"['empal', 'asem', 'amarta', 'adalah', 'sebuah', 'hidangan', 'khas', 'yang', 'terkenal', 'di', 'daerah', 'amarta', 'cirebon', 'empal', 'asem', 'merupakan', 'masakan', 'berbahan', 'dasar', 'daging', 'sapi', 'yang', 'dimasak', 'dengan', 'campuran', 'bumbubumbu', 'rempah', 'dan', 'asemaseman', 'sehingga', 'memberikan', 'cita', 'rasa', 'yang', 'khas', 'dan', 'segar', 'nama', 'amarta', 'mungkin', 'merujuk', 'kepada', 'nama', 'tempat', 'atau', 'mungkin', 'pemilik', 'atau', 'pendiri', 'warung', 'atau', 'kedai', 'yang', 'terkenal', 'dengan', 'hidangan', 'empal', 'asemnya', 'warung', 'empal', 'asem', 'amarta', 'mungkin', 'telah', 'menjadi', 'destinasi', 'yang', 'populer', 'bagi', 'para', 'pecinta', 'kuliner', 'untuk', 'menikmati', 'hidangan', 'yang', 'lezat', 'dan', 'autentik', 'dari', 'daerah', 'amarta', 'cirebon']",<FreqDist with 54 samples and 83 outcomes>,"['empal', 'asem', 'amarta', 'hidangan', 'khas', 'terkenal', 'daerah', 'amarta', 'cirebon', 'empal', 'asem', 'masakan', 'berbahan', 'dasar', 'daging', 'sapi', 'dimasak', 'campuran', 'bumbubumbu', 'rempah', 'asemaseman', 'cita', 'khas', 'segar', 'nama', 'amarta', 'merujuk', 'nama', 'pemilik', 'pendiri', 'warung', 'kedai', 'terkenal', 'hidangan', 'empal', 'asemnya', 'warung', 'empal', 'asem', 'amarta', 'destinasi', 'populer', 'pecinta', 'kuliner', 'menikmati', 'hidangan', 'lezat', 'autentik', 'daerah', 'amarta', 'cirebon']","['empal', 'asem', 'amarta', 'hidang', 'khas', 'kenal', 'daerah', 'amarta', 'cirebon', 'empal', 'asem', 'masakan', 'bahan', 'dasar', 'daging', 'sapi', 'masak', 'campur', 'bumbubumbu', 'rempah', 'asemaseman', 'cita', 'khas', 'segar', 'nama', 'amarta', 'rujuk', 'nama', 'milik', 'diri', 'warung', 'kedai', 'kenal', 'hidang', 'empal', 'asemnya', 'warung', 'empal', 'asem', 'amarta', 'destinasi', 'populer', 'cinta', 'kuliner', 'nikmat', 'hidang', 'lezat', 'autentik', 'daerah', 'amarta', 'cirebon']"
75,268.0,Empal Dengkil Mang Kojek ,empal dengkil mang kojek adalah sebuah hidangan yang terkenal di daerah dengkil yang dikreasikan oleh mang kojek empal dengkil merupakan masakan berbahan dasar daging sapi yang dimasak dengan berbagai bumbu dan rempahrempah kemudian diolah dengan teknik khusus untuk mencapai tekstur yang empuk dan rasa yang lezat mang kojek mungkin merujuk kepada nama seorang koki atau pemilik warung atau kedai yang terkenal dengan hidangan empal dengkilnya warung empal dengkil mang kojek mungkin telah menjadi tujuan kuliner yang populer bagi penduduk setempat dan pengunjung untuk menikmati hidangan khas yang ditawarkan,Wisata Kuliner,"-6.708772003332567, 108.50561227786697","Rp30,000",4.2,20000-50000,"['empal', 'dengkil', 'mang', 'kojek', 'adalah', 'sebuah', 'hidangan', 'yang', 'terkenal', 'di', 'daerah', 'dengkil', 'yang', 'dikreasikan', 'oleh', 'mang', 'kojek', 'empal', 'dengkil', 'merupakan', 'masakan', 'berbahan', 'dasar', 'daging', 'sapi', 'yang', 'dimasak', 'dengan', 'berbagai', 'bumbu', 'dan', 'rempahrempah', 'kemudian', 'diolah', 'dengan', 'teknik', 'khusus', 'untuk', 'mencapai', 'tekstur', 'yang', 'empuk', 'dan', 'rasa', 'yang', 'lezat', 'mang', 'kojek', 'mungkin', 'merujuk', 'kepada', 'nama', 'seorang', 'koki', 'atau', 'pemilik', 'warung', 'atau', 'kedai', 'yang', 'terkenal', 'dengan', 'hidangan', 'empal', 'dengkilnya', 'warung', 'empal', 'dengkil', 'mang', 'kojek', 'mungkin', 'telah', 'menjadi', 'tujuan', 'kuliner', 'yang', 'populer', 'bagi', 'penduduk', 'setempat', 'dan', 'pengunjung', 'untuk', 'menikmati', 'hidangan', 'khas', 'yang', 'ditawarkan']",<FreqDist with 58 samples and 88 outcomes>,"['empal', 'dengkil', 'mang', 'kojek', 'hidangan', 'terkenal', 'daerah', 'dengkil', 'dikreasikan', 'mang', 'kojek', 'empal', 'dengkil', 'masakan', 'berbahan', 'dasar', 'daging', 'sapi', 'dimasak', 'bumbu', 'rempahrempah', 'diolah', 'teknik', 'khusus', 'mencapai', 'tekstur', 'empuk', 'lezat', 'mang', 'kojek', 'merujuk', 'nama', 'koki', 'pemilik', 'warung', 'kedai', 'terkenal', 'hidangan', 'empal', 'dengkilnya', 'warung', 'empal', 'dengkil', 'mang', 'kojek', 'tujuan', 'kuliner', 'populer', 'penduduk', 'pengunjung', 'menikmati', 'hidangan', 'khas', 'ditawarkan']","['empal', 'dengkil', 'mang', 'kojek', 'hidang', 'kenal', 'daerah', 'dengkil', 'kreasi', 'mang', 'kojek', 'empal', 'dengkil', 'masakan', 'bahan', 'dasar', 'daging', 'sapi', 'masak', 'bumbu', 'rempahrempah', 'olah', 'teknik', 'khusus', 'capai', 'tekstur', 'empuk', 'lezat', 'mang', 'kojek', 'rujuk', 'nama', 'koki', 'milik', 'warung', 'kedai', 'kenal', 'hidang', 'empal', 'dengkilnya', 'warung', 'empal', 'dengkil', 'mang', 'kojek', 'tuju', 'kuliner', 'populer', 'duduk', 'unjung', 'nikmat', 'hidang', 'khas', 'tawar']"
76,269.0,Bubur Ayam M.Toha,bubur ayam mtoha adalah bubur ayam yang terkenal yang disajikan di tempat yang dikelola oleh mtoha bubur ayam ini merupakan hidangan yang terdiri dari bubur nasi yang lembut dan disajikan dengan potongan daging ayam irisan daun bawang bawang goreng kerupuk dan beberapa tambahan lainnya seperti cakwe atau telur mungkin mtoha adalah pemilik atau koki yang memiliki resep khusus untuk bubur ayam ini dan telah membuatnya populer di kalangan masyarakat setempat tempat makan bubur ayam mtoha mungkin menjadi tempat favorit bagi pecinta bubur ayam untuk menikmati hidangan lezat yang disajikan,Wisata Kuliner,"-6.704338427384357, 108.55778369027678","Rp7,000",4.6,0-20000,"['bubur', 'ayam', 'mtoha', 'adalah', 'bubur', 'ayam', 'yang', 'terkenal', 'yang', 'disajikan', 'di', 'tempat', 'yang', 'dikelola', 'oleh', 'mtoha', 'bubur', 'ayam', 'ini', 'merupakan', 'hidangan', 'yang', 'terdiri', 'dari', 'bubur', 'nasi', 'yang', 'lembut', 'dan', 'disajikan', 'dengan', 'potongan', 'daging', 'ayam', 'irisan', 'daun', 'bawang', 'bawang', 'goreng', 'kerupuk', 'dan', 'beberapa', 'tambahan', 'lainnya', 'seperti', 'cakwe', 'atau', 'telur', 'mungkin', 'mtoha', 'adalah', 'pemilik', 'atau', 'koki', 'yang', 'memiliki', 'resep', 'khusus', 'untuk', 'bubur', 'ayam', 'ini', 'dan', 'telah', 'membuatnya', 'populer', 'di', 'kalangan', 'masyarakat', 'setempat', 'tempat', 'makan', 'bubur', 'ayam', 'mtoha', 'mungkin', 'menjadi', 'tempat', 'favorit', 'bagi', 'pecinta', 'bubur', 'ayam', 'untuk', 'menikmati', 'hidangan', 'lezat', 'yang', 'disajikan']",<FreqDist with 54 samples and 89 outcomes>,"['bubur', 'ayam', 'mtoha', 'bubur', 'ayam', 'terkenal', 'disajikan', 'dikelola', 'mtoha', 'bubur', 'ayam', 'hidangan', 'bubur', 'nasi', 'lembut', 'disajikan', 'potongan', 'daging', 'ayam', 'irisan', 'daun', 'bawang', 'bawang', 'goreng', 'kerupuk', 'tambahan', 'cakwe', 'telur', 'mtoha', 'pemilik', 'koki', 'memiliki', 'resep', 'khusus', 'bubur', 'ayam', 'membuatnya', 'populer', 'kalangan', 'masyarakat', 'makan', 'bubur', 'ayam', 'mtoha', 'favorit', 'pecinta', 'bubur', 'ayam', 'menikmati', 'hidangan', 'lezat', 'disajikan']","['bubur', 'ayam', 'mtoha', 'bubur', 'ayam', 'kenal', 'saji', 'kelola', 'mtoha', 'bubur', 'ayam', 'hidang', 'bubur', 'nasi', 'lembut', 'saji', 'potong', 'daging', 'ayam', 'iris', 'daun', 'bawang', 'bawang', 'goreng', 'kerupuk', 'tambah', 'cakwe', 'telur', 'mtoha', 'milik', 'koki', 'milik', 'resep', 'khusus', 'bubur', 'ayam', 'buat', 'populer', 'kalang', 'masyarakat', 'makan', 'bubur', 'ayam', 'mtoha', 'favorit', 'cinta', 'bubur', 'ayam', 'nikmat', 'hidang', 'lezat', 'saji']"
77,270.0,Mie Colot,mie colot adalah sebuah hidangan mie khas yang berasal dari daerah cirebon jawa barat mie colot terkenal karena tekstur mie yang khas dan bumbu kuahnya yang lezat mie ini berbeda dari mie pada umumnya karena mie colot memiliki tekstur yang lebih kenyal dan tebal biasanya mie colot disajikan dengan kuah yang kental dan gurih serta ditambahi dengan berbagai bahan pelengkap seperti tauge irisan daun bawang emping dan kerupuk keistimewaan mie colot juga terletak pada cara penyajiannya mie ini biasanya disajikan dengan cara yang unik yaitu menggunakan batang bambu sebagai wadahnya ketika disantap mie colot biasanya diaduk dengan bumbu dan bahan pelengkapnya menggunakan tusuk sate atau sumpit sehingga memberikan pengalaman yang berbeda dan menarik mie colot sangat populer di daerah cirebon dan menjadi hidangan favorit bagi penduduk setempat maupun wisatawan yang berkunjung rasanya yang lezat dan cara penyajiannya yang unik membuat mie colot menjadi salah satu kuliner yang patut dicoba jika mengunjungi cirebon,Wisata Kuliner,"-6.718264927714273, 108.56399032205755","Rp17,000",4.4,0-20000,"['mie', 'colot', 'adalah', 'sebuah', 'hidangan', 'mie', 'khas', 'yang', 'berasal', 'dari', 'daerah', 'cirebon', 'jawa', 'barat', 'mie', 'colot', 'terkenal', 'karena', 'tekstur', 'mie', 'yang', 'khas', 'dan', 'bumbu', 'kuahnya', 'yang', 'lezat', 'mie', 'ini', 'berbeda', 'dari', 'mie', 'pada', 'umumnya', 'karena', 'mie', 'colot', 'memiliki', 'tekstur', 'yang', 'lebih', 'kenyal', 'dan', 'tebal', 'biasanya', 'mie', 'colot', 'disajikan', 'dengan', 'kuah', 'yang', 'kental', 'dan', 'gurih', 'serta', 'ditambahi', 'dengan', 'berbagai', 'bahan', 'pelengkap', 'seperti', 'tauge', 'irisan', 'daun', 'bawang', 'emping', 'dan', 'kerupuk', 'keistimewaan', 'mie', 'colot', 'juga', 'terletak', 'pada', 'cara', 'penyajiannya', 'mie', 'ini', 'biasanya', 'disajikan', 'dengan', 'cara', 'yang', 'unik', 'yaitu', 'menggunakan', 'batang', 'bambu', 'sebagai', 'wadahnya', 'ketika', 'disantap', 'mie', 'colot', 'biasanya', 'diaduk', 'dengan', 'bumbu', 'dan', 'bahan', 'pelengkapnya', 'menggunakan', 'tusuk', 'sate', 'atau', 'sumpit', 'sehingga', 'memberikan', 'pengalaman', 'yang', 'berbeda', 'dan', 'menarik', 'mie', 'colot', 'sangat', 'populer', 'di', 'daerah', 'cirebon', 'dan', 'menjadi', 'hidangan', 'favorit', 'bagi', 'penduduk', 'setempat', 'maupun', 'wisatawan', 'yang', 'berkunjung', 'rasanya', 'yang', 'lezat', 'dan', 'cara', 'penyajiannya', 'yang', 'unik', 'membuat', 'mie', 'colot', 'menjadi', 'salah', 'satu', 'kuliner', 'yang', 'patut', 'dicoba', 'jika', 'mengunjungi', 'cirebon']",<FreqDist with 90 samples and 152 outcomes>,"['mie', 'colot', 'hidangan', 'mie', 'khas', 'berasal', 'daerah', 'cirebon', 'jawa', 'barat', 'mie', 'colot', 'terkenal', 'tekstur', 'mie', 'khas', 'bumbu', 'kuahnya', 'lezat', 'mie', 'berbeda', 'mie', 'mie', 'colot', 'memiliki', 'tekstur', 'kenyal', 'tebal', 'mie', 'colot', 'disajikan', 'kuah', 'kental', 'gurih', 'ditambahi', 'bahan', 'pelengkap', 'tauge', 'irisan', 'daun', 'bawang', 'emping', 'kerupuk', 'keistimewaan', 'mie', 'colot', 'terletak', 'penyajiannya', 'mie', 'disajikan', 'unik', 'batang', 'bambu', 'wadahnya', 'disantap', 'mie', 'colot', 'diaduk', 'bumbu', 'bahan', 'pelengkapnya', 'tusuk', 'sate', 'sumpit', 'pengalaman', 'berbeda', 'menarik', 'mie', 'colot', 'populer', 'daerah', 'cirebon', 'hidangan', 'favorit', 'penduduk', 'wisatawan', 'berkunjung', 'lezat', 'penyajiannya', 'unik', 'mie', 'colot', 'salah', 'kuliner', 'patut', 'dicoba', 'mengunjungi', 'cirebon']","['mie', 'colot', 'hidang', 'mie', 'khas', 'asal', 'daerah', 'cirebon', 'jawa', 'barat', 'mie', 'colot', 'kenal', 'tekstur', 'mie', 'khas', 'bumbu', 'kuah', 'lezat', 'mie', 'beda', 'mie', 'mie', 'colot', 'milik', 'tekstur', 'kenyal', 'tebal', 'mie', 'colot', 'saji', 'kuah', 'kental', 'gurih', 'tambah', 'bahan', 'lengkap', 'tauge', 'iris', 'daun', 'bawang', 'emping', 'kerupuk', 'istimewa', 'mie', 'colot', 'letak', 'saji', 'mie', 'saji', 'unik', 'batang', 'bambu', 'wadah', 'santap', 'mie', 'colot', 'aduk', 'bumbu', 'bahan', 'lengkap', 'tusuk', 'sate', 'sumpit', 'alam', 'beda', 'tarik', 'mie', 'colot', 'populer', 'daerah', 'cirebon', 'hidang', 'favorit', 'duduk', 'wisatawan', 'kunjung', 'lezat', 'saji', 'unik', 'mie', 'colot', 'salah', 'kuliner', 'patut', 'coba', 'unjung', 'cirebon']"
